original_question,masked_question,nouns,noun_count
"A fluorescent molecule of 1,000 daltons injected into one cell is observed to enter an adjacent cell by passing through a",() fluorescent molecule () () daltons injected () () cell () observed () enter () () cell () passing () (),"['fluorescent', 'molecule', 'daltons', 'injected', 'cell', 'observed', 'enter', 'cell', 'passing']",9
Which of the following is not a true statement?,() () () following () () () true statement (),"['following', 'true', 'statement']",3
Surveys of older adults who are living together show that they tend to view cohabitation as,Surveys () older adults () () living () show () () tend () view cohabitation (),"['Surveys', 'older', 'adults', 'living', 'show', 'tend', 'view', 'cohabitation']",8
"Third-year student is studying contracts. He has learned that generally all contractual rights may be assigned, but there are some exceptions. Which of the following is not an exception?",Third () () student () studying contracts () () () learned () () () contractual rights () () assigned () () () are () exceptions () () () () following () () () exception (),"['Third', 'year', 'student', 'studying', 'contracts', 'contractual', 'rights', 'assigned', 'are', 'exceptions', 'following', 'exception']",12
The particular quality of the U.S. health care system is its:,() particular quality () () U.S. health care system () () (),"['particular', 'quality', 'U.S.', 'health', 'care', 'system']",6
"A 15-year-old male presents to the office with the complaint of painless swelling in the left testicle that has varied in size over the past several months. There is no history of trauma. The lesion transilluminates well, and no inguinal nodes are palpable. Findings from a testicular scan are normal. The most appropriate management includes",() () () year () old () presents () () office () () () () painless swelling () () left testicle () () varied () size () () past several months () () is () history () trauma () () lesion transilluminates () () () () inguinal nodes () palpable () Findings () () testicular scan () normal () () () appropriate management includes,"['year', 'old', 'male', 'presents', 'office', 'painless', 'swelling', 'left', 'testicle', 'varied', 'size', 'past', 'several', 'months', 'is', 'history', 'trauma', 'lesion', 'transilluminates', 'inguinal', 'nodes', 'palpable', 'Findings', 'scan', 'appropriate', 'management', 'includes']",27
"A sister and brother own a ranch as joint tenants. If the sister transfers her interest by quitclaim deed to her friend without the brother's knowledge, what interest, if any, does the friend have in the ranch?",() sister () () own () ranch () joint tenants () () () sister transfers () interest () quitclaim deed () () friend () () brother () knowledge () () interest () () () () () () friend have () () ranch (),"['sister', 'own', 'ranch', 'joint', 'tenants', 'sister', 'transfers', 'interest', 'quitclaim', 'deed', 'friend', 'brother', 'knowledge', 'interest', 'friend', 'have', 'ranch']",17
"For which of these two scenarios does the main character (who uses I/me/my) do something clearly morally wrong, according to ordinary moral standards in the US as of 2020? Scenario 1 | I buy dog food to feed my neighbors dog. Scenario 2 | I ate the produce after paying.",() () () () () () () () () character () () uses () () () () () () do something () () wrong () according () ordinary moral standards () () US () () () () Scenario () () () buy dog food () feed () neighbors dog () Scenario () () () ate () produce () paying (),"['main', 'uses', 'do', 'something', 'wrong', 'according', 'ordinary', 'moral', 'standards', 'US', 'Scenario', 'buy', 'dog', 'food', 'feed', 'neighbors', 'dog', 'Scenario', 'ate', 'produce', 'paying']",21
"For which of these two scenarios does the main character (who uses I/me/my) do something clearly morally wrong, according to ordinary moral standards in the US as of 2020? Scenario 1 | I spent my afternoon peeing in the pool. Scenario 2 | I briefly shouted to my friend in the public theater as the movie played.",() () () () () scenarios () () main character () () () () () () () () () do something () () () () according () ordinary moral standards () () US () () () () Scenario () () () spent () afternoon peeing () () pool () Scenario () () () () shouted () () friend () () public theater () () movie played (),"['scenarios', 'main', 'character', 'do', 'something', 'wrong', 'ordinary', 'moral', 'standards', 'US', 'Scenario', 'spent', 'afternoon', 'peeing', 'pool', 'Scenario', 'shouted', 'friend', 'public', 'theater', 'movie', 'played']",22
"A manager's competitor sent a defamatory letter to the manager accusing him of professional incompetence and calling him one of the worst businessmen in town. It was addressed to the manager. He read it, put it in a private drawer, and did not read it again. Later, he tried to sue the competitor for defamation as a result of the letter. Will the court likely grant the defendant's motion to dismiss, and on what grounds? Base your answer on the common law definition of defamation.",() manager () competitor sent () () letter () () manager accusing () () professional incompetence () () () () () () worst businessmen () town () () () addressed () () manager () () read () () put () () () private drawer () () () () read () () () () () () tried () sue () competitor () defamation () () result () () letter () () () court () grant () defendant () motion () dismiss () () () () grounds () Base () answer () () common law definition () defamation (),"['manager', 'competitor', 'sent', 'defamatory', 'letter', 'manager', 'accusing', 'professional', 'incompetence', 'worst', 'businessmen', 'town', 'addressed', 'manager', 'read', 'put', 'private', 'drawer', 'read', 'tried', 'sue', 'competitor', 'defamation', 'letter', 'court', 'grant', 'defendant', 'motion', 'dismiss', 'grounds', 'Base', 'answer', 'common', 'definition', 'defamation']",35
"A company owns and operates a chemical plant that manufactures paraquat, an herbicide used primarily as a weed killer. The plant is located in a rural area in the southwestern part of the state. In its production of paraquat, the company emits putrid smelling fumes throughout the surrounding countryside. Although the fumes are harmless to health, they are rank and highly offensive. Despite extensive research by the company to alleviate the problem, there is no known way to manufacture paraquat without discharging malodorous fumes into the air. An owner of a large dairy farm that is adjacent to the plant finds the foul-smelling herbicide fumes to be extremely unpleasant and totally objectionable. The owner brings an action based on private nuisance against the company and seeks to enjoin the manufacture of paraquat at the chemical plant. Which of the following facts, if proven, will be most helpful to the company's defense?",() company () () operates () () plant () manufactures paraquat () () herbicide used () () () weed () () () plant () located () () rural area () () southwestern part () () state () () () production () paraquat () () company emits putrid smelling fumes () () surrounding countryside () () () fumes () harmless () health () () () rank () () offensive () () extensive research () () company () alleviate () problem () () is () known way () manufacture paraquat () discharging malodorous fumes () () air () () owner () () large dairy farm () () adjacent () () plant finds () foul () smelling herbicide fumes () () () unpleasant () () objectionable () () owner brings () action based () private nuisance () () company () seeks () enjoin () manufacture () paraquat () () chemical plant () () () () following facts () () proven () () () () helpful () () company () defense (),"['company', 'owns', 'operates', 'chemical', 'plant', 'manufactures', 'paraquat', 'herbicide', 'used', 'weed', 'killer', 'plant', 'located', 'rural', 'area', 'southwestern', 'part', 'state', 'production', 'paraquat', 'company', 'emits', 'putrid', 'smelling', 'fumes', 'surrounding', 'harmless', 'health', 'offensive', 'extensive', 'research', 'company', 'alleviate', 'problem', 'is', 'known', 'way', 'manufacture', 'paraquat', 'discharging', 'malodorous', 'fumes', 'owner', 'large', 'dairy', 'farm', 'adjacent', 'plant', 'finds', 'foul', 'smelling', 'herbicide', 'fumes', 'unpleasant', 'owner', 'brings', 'action', 'based', 'private', 'nuisance', 'company', 'enjoin', 'manufacture', 'paraquat', 'chemical', 'following', 'facts', 'proven', 'helpful', 'company', 'defense']",71
The GDP Deflator differs from the CPI in that the GDP Deflator,() GDP Deflator differs () () CPI () () () GDP Deflator,"['GDP', 'Deflator', 'differs', 'CPI', 'GDP', 'Deflator']",6
Da Vinci's Mona Lisa is_____.,Da Vinci () Mona Lisa is_____ (),"['Da', 'Vinci', 'Mona', 'Lisa', 'is_____']",5
"Which of the following statements is true concerning variance decomposition analysis of VARs?

i) Variance decompositions measure the impact of a unit shock to each of the variables on the VAR

ii) Variance decompositions can be thought of as measuring the proportion of the forecast error variance that is attributable to each variable

iii) The ordering of the variables is important for calculating impulse responses but not variance decompositions

iv) It is usual that most of the forecast error variance for a given variable is attributable to shocks to that variable",() () () following statements () true concerning variance () analysis () VARs () () Variance decompositions measure () impact () () unit shock () () () () variables () () VAR () () Variance decompositions () () thought () () measuring () proportion () () forecast error variance () () attributable () () variable () () () ordering () () variables () important () calculating impulse responses () () variance decompositions () () () () usual () most () () forecast error variance () () given variable () attributable () shocks () () variable,"['following', 'statements', 'true', 'concerning', 'variance', 'decomposition', 'analysis', 'VARs', 'Variance', 'decompositions', 'measure', 'unit', 'shock', 'variables', 'VAR', 'Variance', 'decompositions', 'thought', 'measuring', 'proportion', 'forecast', 'error', 'attributable', 'variable', 'ordering', 'variables', 'important', 'calculating', 'impulse', 'responses', 'variance', 'usual', 'most', 'forecast', 'error', 'given', 'variable', 'attributable', 'shocks', 'variable']",40
Papilloma viruses are characterised by what genetic feature?,Papilloma viruses () characterised () () genetic feature (),"['Papilloma', 'viruses', 'characterised', 'genetic', 'feature']",5
"For which of these two scenarios does the main character (who uses I/me/my) do something clearly morally wrong, according to ordinary moral standards in the US as of 2020? Scenario 1 | I ate a slice of my friends tasty shoulder. Scenario 2 | I started a forest camp fire and burned some twigs and shrubs.",() () () () () scenarios () () main character () () () () () () () () () do something () () wrong () according () ordinary moral standards () () US () () () () Scenario () () () ate () slice () () friends tasty shoulder () Scenario () () () started () forest camp fire () burned () twigs () shrubs (),"['scenarios', 'main', 'character', 'do', 'something', 'wrong', 'according', 'ordinary', 'moral', 'standards', 'US', 'Scenario', 'ate', 'slice', 'friends', 'tasty', 'shoulder', 'Scenario', 'started', 'forest', 'fire', 'burned', 'twigs', 'shrubs']",24
"A defendant worked as a patent attorney in a law firm. Late one evening, she left the office and walked outside to her car. While in the parking lot, she noticed a gold watch lying on the ground. When the defendant picked it up, she immediately identified the watch as belonging to one of the other lawyers in her law firm. She took it home with her, intending to return it the next day. The following morning, however, the defendant decided to keep the watch, and did so. The defendant has committed",() defendant () () () patent attorney () () law () () () () evening () () left () office () walked () () () car () () () () parking lot () () noticed () gold watch lying () () ground () () () defendant picked () () () () () identified () watch () belonging () () () () other lawyers () () law firm () () took () () () () () intending () return () () next day () () following morning () () () () defendant decided () keep () watch () () did () () () defendant () committed,"['defendant', 'worked', 'patent', 'attorney', 'law', 'firm', 'left', 'office', 'walked', 'parking', 'lot', 'gold', 'watch', 'lying', 'ground', 'defendant', 'picked', 'identified', 'watch', 'belonging', 'other', 'lawyers', 'law', 'firm', 'took', 'intending', 'return', 'next', 'day', 'following', 'morning', 'defendant', 'decided', 'keep', 'watch', 'did', 'committed']",37
"Two law students were having lunch one afternoon when the first student said to the second, ""I'm thinking of selling my car. "" The second student replied, ""I might be interested in buying your car if the price is reasonable and I can convince my parents to float me a loan. "" The first student then grabbed a piece of paper and wrote the following on it:""I will sell you my car for $1,000. In exchange for $1 received this day, I agree that you can have one month from today's date to decide whether to accept this offer. ""The first student then signed the paper and handed it to the second student. The second student handed a one dollar bill to the first student and left. One week later, the second student succeeded in obtaining a $1,000 loan from his parents. He then telephoned the first student to accept the offer. Upon hearing the second student say hello, and before the second student could accept the offer, the first student said, ""I've changed my mind. I do not want to sell my car. ""Can the second student still accept the first student's offer?",() law students () () () () afternoon () () () () () () () second () () () () thinking () selling () car () () () second student replied () () () () () interested () buying () car () () price () reasonable () () () convince () parents () float () () loan () () () first student () grabbed () piece () paper () wrote () following () () () () () () sell () () car () () () () () exchange () () () received () day () () agree () () () have () month () today () date () decide () () accept () offer () () () first student () signed () paper () handed () () () second student () () second student handed () () dollar bill () () first student () left () () week () () () second student succeeded () obtaining () () () loan () () parents () () () telephoned () first student () accept () offer () () hearing () second student say () () () () () second student () accept () offer () () first student said () () () () changed () mind () () () () want () sell () car () () () () second student () accept () first student () offer (),"['law', 'students', 'having', 'lunch', 'afternoon', 'first', 'said', 'thinking', 'selling', 'car', 'second', 'student', 'replied', 'interested', 'buying', 'car', 'price', 'reasonable', 'convince', 'float', 'loan', 'first', 'student', 'grabbed', 'piece', 'wrote', 'following', 'sell', 'car', 'exchange', 'received', 'day', 'agree', 'have', 'month', 'today', 'date', 'decide', 'accept', 'offer', 'first', 'student', 'signed', 'paper', 'handed', 'second', 'student', 'second', 'handed', 'dollar', 'bill', 'first', 'student', 'week', 'second', 'student', 'succeeded', 'obtaining', 'loan', 'parents', 'telephoned', 'first', 'student', 'accept', 'offer', 'student', 'say', 'second', 'student', 'offer', 'first', 'student', 'said', 'changed', 'mind', 'want', 'sell', 'car', 'second', 'student', 'accept', 'first', 'student', 'offer']",84
What high school does the gang from the 'Archie' comic strip attend?,() high school () () gang () () () Archie () comic strip attend (),"['high', 'school', 'gang', 'Archie', 'comic', 'strip', 'attend']",7
"Let A and B be sets, f: A -> B and g: B -> A be functions such that for all a \in A, g(f(a)) = a. Statement 1 | The function f must necessarily be injective. Statement 2 | The function f must necessarily be surjective.",Let () () B () sets () () () A () B () g () B () () () functions such () () () () \in A () g( f( () () () () a. Statement () () () function f () () () injective () Statement () () () function f () () () surjective (),"['Let', 'B', 'sets', 'A', 'B', 'B', 'functions', '\\in', 'A', 'g(', 'f(', 'a.', 'Statement', 'function', 'f', 'injective', 'Statement', 'function', 'f', 'surjective']",20
The most frequent chronic condition for older adults is,() () frequent chronic condition () older adults (),"['frequent', 'chronic', 'condition', 'older', 'adults']",5
" Van den Haag responds to the ""miscarriages of justice"" objection by claiming that",Van den Haag responds () () () miscarriages () justice () objection () claiming (),"['Van', 'den', 'Haag', 'responds', 'miscarriages', 'justice', 'objection', 'claiming']",8
"For which of these two scenarios does the main character (who uses I/me/my) do something clearly morally wrong, according to ordinary moral standards in the US as of 2020? Scenario 1 | I called into work because I didn't want to work. Scenario 2 | I called the cops on the man who hit no one",() () () () () scenarios () () main character () () uses () () () () () () () something () () wrong () () () ordinary moral standards () () US () () () () Scenario () () () called () work () () () () want () work () Scenario () () () called () cops () () man () hit () one,"['scenarios', 'main', 'character', 'uses', 'something', 'wrong', 'ordinary', 'moral', 'standards', 'US', 'Scenario', 'called', 'work', 'want', 'work', 'Scenario', 'called', 'cops', 'man', 'hit', 'one']",21
"A 37-year-old woman with right lower extremity edema is evaluated because of the sudden onset of shortness of breath and pleuritic chest pain. A diagnosis of pulmonary embolism is made. Which of the following signs, if present on physical examination, would be the most specific indicator of pulmonary arterial hypertension in this patient?",() () () year () old woman () right lower extremity edema () evaluated () () () sudden onset () shortness () breath () () () pain () () diagnosis () pulmonary embolism () made () () () () following signs () () present () physical examination () () () () () specific indicator () pulmonary arterial hypertension () () patient (),"['year', 'old', 'woman', 'right', 'lower', 'extremity', 'edema', 'evaluated', 'sudden', 'onset', 'shortness', 'breath', 'pain', 'diagnosis', 'pulmonary', 'embolism', 'made', 'following', 'signs', 'present', 'physical', 'examination', 'specific', 'pulmonary', 'arterial', 'hypertension', 'patient']",27
Hume's attack on natural law is founded on his argument that:,Hume () attack () natural law () founded () () argument () (),"['Hume', 'attack', 'natural', 'law', 'founded', 'argument']",6
Which of the following is likely to have a demand curve that is the least elastic?,() () () following () likely () have () demand curve () () () least elastic (),"['following', 'likely', 'have', 'demand', 'curve', 'least', 'elastic']",7
Find the value of the expression −25 − (−11).,Find () value () () expression () () () () () () (),"['Find', 'value', 'expression']",3
"A husband and wife had a stormy relationship. The husband, who was an alcoholic, frequently beat his wife when he became drunk. One day, the husband had been drinking beer while watching football on television. After his favorite team lost a close game, the husband went into a violent rage. As he was storming around the apartment, he suddenly grabbed his wife and led her outside to their car. He then ordered her to get inside the vehicle. The husband was driving around aimlessly when he negligently collided with another car. The other driver, who was injured in the accident, brought suit against the husband to recover damages. Thereafter, the husband retained an attorney to represent him. At his first consultation with the attorney, the husband was accompanied by his wife. During the conference, the attorney's secretary took notes of the meeting. Two weeks later, the wife separated from the husband. She then hired a lawyer to represent her in a suit against the husband for battery and false imprisonment. At the trial between the husband and the other driver, the other driver's attorney calls the wife to testify. She proposes to testify that her husband was intoxicated at the time of the accident. Upon objection by the husband's attorney, the wife's proposed testimony will most likely be",() husband () () had () () () () () husband () () () () alcoholic () () () () wife () () became drunk () () day () () husband () () drinking beer () watching football () television () () () favorite team lost () close game () () husband went () () violent rage () () () () storming () () apartment () () () grabbed () wife () led () () () () car () () () ordered () () get () () vehicle () () husband () driving () () () () () collided () () car () () other driver () () () injured () () accident () brought suit () () husband () recover damages () () () () husband retained () attorney () represent () () () () first consultation () () attorney () () husband () accompanied () () wife () () () conference () () attorney () secretary took notes () () meeting () () weeks () () () wife separated () () husband () () () hired () lawyer () represent () () () suit () () husband () battery () false imprisonment () () () trial () () husband () () other driver () () other driver () attorney calls () wife () testify () () proposes () testify () () husband () intoxicated () () time () () accident () () objection () () husband () attorney () () wife () proposed testimony () () () (),"['husband', 'had', 'stormy', 'relationship', 'husband', 'alcoholic', 'beat', 'wife', 'became', 'drunk', 'day', 'husband', 'beer', 'watching', 'football', 'television', 'favorite', 'team', 'lost', 'close', 'husband', 'went', 'violent', 'rage', 'storming', 'apartment', 'grabbed', 'wife', 'led', 'car', 'ordered', 'get', 'vehicle', 'husband', 'driving', 'collided', 'car', 'driver', 'accident', 'brought', 'suit', 'husband', 'recover', 'damages', 'husband', 'retained', 'represent', 'first', 'consultation', 'attorney', 'husband', 'accompanied', 'wife', 'conference', 'attorney', 'secretary', 'took', 'notes', 'meeting', 'weeks', 'wife', 'separated', 'husband', 'hired', 'lawyer', 'represent', 'husband', 'battery', 'false', 'imprisonment', 'trial', 'husband', 'driver', 'other', 'driver', 'attorney', 'calls', 'wife', 'testify', 'proposes', 'testify', 'husband', 'intoxicated', 'time', 'accident', 'objection', 'attorney', 'wife', 'proposed', 'testimony']",90
"For which of these two scenarios does the main character (who uses I/me/my) do something clearly morally wrong, according to ordinary moral standards in the US as of 2020? Scenario 1 | I hid the birthday gift in my bedroom. Scenario 2 | I invested her life savings in a high-return account.",() () () () () scenarios () () main character () () uses () () () () () () do something () () wrong () according () ordinary moral standards () () US () () () () Scenario () () () hid () birthday gift () () bedroom () Scenario () () () invested () life savings () () high () return account (),"['scenarios', 'main', 'character', 'uses', 'do', 'something', 'wrong', 'according', 'ordinary', 'moral', 'standards', 'US', 'Scenario', 'hid', 'birthday', 'bedroom', 'Scenario', 'invested', 'savings', 'high', 'return', 'account']",22
Which of the following is true about the assessment of arm reflexes?,() () () following () true () () assessment () arm reflexes (),"['following', 'true', 'assessment', 'arm', 'reflexes']",5
Which of these statements concerning the study of identity is not applicable to social constructivism?,() () () statements concerning () study () identity () () applicable () social constructivism (),"['statements', 'concerning', 'study', 'identity', 'applicable', 'social', 'constructivism']",7
" Kant's Universal Law formulation does not refer to an agent's wants; rather, it represents",Kant () Universal Law formulation () () refer () () agent () wants () () () () represents,"['Kant', 'Universal', 'Law', 'formulation', 'refer', 'agent', 'wants', 'represents']",8
"The Space Shuttle orbits 300 km above Earth’s surface; Earth’s radius is 6,400 km. What is the gravitational acceleration experienced by the Space Shuttle?",() Space Shuttle orbits () km () () () surface () Earth () radius () () km () () () () gravitational acceleration experienced () () Space Shuttle (),"['Space', 'Shuttle', 'orbits', 'km', 'surface', 'Earth', 'radius', 'km', 'gravitational', 'acceleration', 'experienced', 'Space', 'Shuttle']",13
"Which of the following sites has monumental earthworks with concentric ridges in a semicircle that date from around 3,500 years ago?",() () () following sites has monumental earthworks () concentric () () () semicircle () date () () () years () (),"['following', 'sites', 'has', 'monumental', 'earthworks', 'concentric', 'semicircle', 'date', 'years']",9
Which cells in the blood do not have a nucleus?,() cells () () blood () () have () nucleus (),"['cells', 'blood', 'have', 'nucleus']",4
"Which country has undergone the most rapid nutrition transition in the last two decades?
",() country () undergone () () rapid nutrition transition () () last () decades (),"['country', 'undergone', 'rapid', 'nutrition', 'transition', 'last', 'decades']",7
"In recent research, the 14,000 stories that could be accessed on Google News' front page in a day pertained to how many actual news events?",() recent research () () () stories () () () accessed () Google News () () page () () day pertained () () many actual news events (),"['recent', 'research', 'stories', 'accessed', 'Google', 'News', 'page', 'day', 'pertained', 'many', 'actual', 'news', 'events']",13
