original_question,masked_question,nouns,noun_count
"A small business estimates price elasticity of demand for the product to be 3. To raise total revenue, owners should",() () business estimates price elasticity () demand () () product () () () () () raise total revenue () owners (),"['small', 'business', 'estimates', 'price', 'elasticity', 'demand', 'product', 'total', 'revenue', 'owners']",10
"For which of these two scenarios does the main character (who uses I/me/my) do something clearly morally wrong, according to ordinary moral standards in the US as of 2020? Scenario 1 | I wanted to know how my sister really felt about me, so I read her diary. Scenario 2 | In order to receive a good grade, I worked hard to pay my teacher.",() () () () () () () () main character () () () () () () () () () do something () () wrong () according () ordinary moral standards () () US () () () () Scenario () () () wanted () know () () sister () felt () () () () () read () diary () Scenario () () () order () receive () good grade () () worked () () pay () teacher (),"['scenarios', 'main', 'character', 'uses', 'do', 'something', 'wrong', 'according', 'ordinary', 'moral', 'standards', 'US', 'Scenario', 'wanted', 'know', 'sister', 'felt', 'read', 'diary', 'Scenario', 'order', 'receive', 'grade', 'worked', 'pay']",25
"Biologists around the world have increased efforts at conservation. Monitoring wildlife populations is important so that appropriate management efforts can be implemented, but such monitoring is often difficult. One study found a cheap and easy way to estimate the number of nesting sites of terns (a type of seabird) by monitoring the number of calls heard per minute. More calls happen when there are more birds, as one would expect. In fact, it turned out that the number of calls explained 71% of the variation in the abundance of nests between breeding sites. Which of the following statements is correct about the correlation between the number of calls and the abundance of nests?",Biologists () () world () increased () () conservation () Monitoring wildlife populations () important () () appropriate management efforts () () implemented () () such () () () () () () study found () cheap () easy way () estimate () number () nesting sites () terns () () type () seabird () () monitoring () number () calls heard () minute () More calls happen () () are more birds () () () () expect () () fact () () turned () () () number () calls explained () % () () variation () () abundance () nests () breeding sites () () () () following statements () correct () () correlation () () number () calls () () abundance () nests (),"['Biologists', 'world', 'increased', 'efforts', 'conservation', 'Monitoring', 'wildlife', 'populations', 'important', 'appropriate', 'management', 'efforts', 'implemented', 'such', 'monitoring', 'difficult', 'study', 'found', 'cheap', 'way', 'estimate', 'number', 'nesting', 'sites', 'type', 'seabird', 'monitoring', 'number', 'calls', 'More', 'calls', 'happen', 'more', 'birds', 'expect', 'fact', 'turned', 'number', 'calls', 'explained', '%', 'variation', 'abundance', 'nests', 'breeding', 'sites', 'following', 'statements', 'correct', 'correlation', 'number', 'calls', 'abundance', 'nests']",54
"Which of the following statements is correct concerning the ""reasonable person"" standard in tort law?",() () () following statements () correct concerning () () reasonable person () standard () tort law (),"['following', 'statements', 'correct', 'concerning', 'reasonable', 'person', 'standard', 'tort', 'law']",9
Urban agriculture can benefit urban society in all of the following ways EXCEPT,Urban agriculture () benefit urban society () () () () following ways (),"['Urban', 'agriculture', 'benefit', 'urban', 'society', 'following', 'ways']",7
Which among the following prevents overfitting when we perform bagging?,() () () following prevents overfitting () () perform bagging (),"['following', 'prevents', 'overfitting', 'perform', 'bagging']",5
 Economic—marketing should encourage long-term economic development as opposed to short-term economic development.,Economic () marketing () () long () term economic development () opposed () short () term economic development (),"['Economic', 'marketing', 'long', 'term', 'economic', 'development', 'opposed', 'short', 'term', 'economic', 'development']",11
"Apart from the fact that it is ""not a nice thing to do"", what is an important ethical disadvantage of deceiving participants?",() () () fact () () () () () () nice thing () do () () () () () important ethical disadvantage () deceiving participants (),"['fact', 'nice', 'thing', 'do', 'important', 'ethical', 'disadvantage', 'deceiving', 'participants']",9
"A man conveys to his wife's cousin a property to ""cousin and the heirs of his body."" He then conveys the same property to his niece in fee simple. Under modern real estate laws and practice in most states today, what interest if any does his niece have?",() man () () () wife () cousin () property () () () () () heirs () () body () () () () conveys () same property () () niece () fee simple () () modern real estate laws () practice () most states today () () interest () () () () niece have (),"['man', 'conveys', 'wife', 'cousin', 'property', 'heirs', 'body', 'conveys', 'property', 'niece', 'fee', 'simple', 'modern', 'real', 'estate', 'laws', 'practice', 'most', 'states', 'today', 'interest', 'niece', 'have']",23
Which of the following statements concerning a sarcomere of a striated muscle (such as skeletal muscle) is correct?,() () () following () concerning () sarcomere () () striated muscle () such () skeletal muscle () () correct (),"['following', 'concerning', 'sarcomere', 'striated', 'muscle', 'such', 'skeletal', 'muscle', 'correct']",9
"The development of civilization in Mesopotamia is associated with the _______, during the ______.",() development () civilization () Mesopotamia () associated () () () () () () () (),"['development', 'civilization', 'Mesopotamia', 'associated']",4
 Which Jaina group only allows women to lead a life of semi-renunciation?,() Jaina group () allows women () lead () life () semi-renunciation (),"['Jaina', 'group', 'allows', 'women', 'lead', 'life', 'semi-renunciation']",7
"A researcher mailed 1,000 questionnaires to members of a labor union and received 300 back. Most of those who returned the questionnaires indicated that they were dissatisfied with the union. Results based only on the returned questionnaires are most likely contaminated by",() researcher mailed () questionnaires () () () () labor union () received () back () Most () () () returned () questionnaires indicated () () () dissatisfied () () union () Results based () () () returned questionnaires () () () contaminated (),"['researcher', 'mailed', 'questionnaires', 'labor', 'union', 'received', 'back', 'Most', 'returned', 'questionnaires', 'indicated', 'dissatisfied', 'union', 'Results', 'based', 'returned', 'questionnaires', 'contaminated']",18
" Construct a complete truth table for the following argument. Then, using the truth table, determine whether the argument is valid or invalid. If the argument is invalid, choose an option which presents a counterexample. (There may be other counterexamples as well.)
M ∨ N
~M · O / N",Construct () complete truth () () () following argument () () () using () truth table () determine () () argument () valid () invalid () () () argument () invalid () choose () option () presents () counterexample () () () () be other counterexamples () () () () M () N () M () O () N,"['Construct', 'complete', 'truth', 'table', 'following', 'argument', 'using', 'truth', 'table', 'determine', 'argument', 'valid', 'invalid', 'argument', 'invalid', 'option', 'presents', 'counterexample', 'be', 'other', 'counterexamples', 'M', 'N', 'M', 'N']",25
In all-out exercise such as sprinting the first fibre types to fatigue are the:,() () () () exercise such () sprinting () first fibre types () fatigue () () (),"['exercise', 'such', 'sprinting', 'first', 'fibre', 'types', 'fatigue']",7
Which of the following is not a recognized complication of cystic fibrosis?,() () () following () () () recognized complication () cystic fibrosis (),"['following', 'recognized', 'complication', 'cystic', 'fibrosis']",5
" According to the British Government, which of the following is not a marketing function?",According () () British Government () () () () following () () () marketing function (),"['According', 'British', 'Government', 'following', 'marketing', 'function']",6
"A defendant was prosecuted for murder. At trial, the prosecutor called a police detective to testify. The detective, who questioned the defendant at the station house after his arrest, testified that the defendant initially declared his innocence. The detective further testified that when given the opportunity to take a lie detector test, the defendant refused. The defendant's attorney did not object to the detective's testimony. The defendant was convicted and sentenced to prison. The defendant, who is now represented by a new attorney, appeals, claiming that it was error to admit the detective's testimony. The appellate court should find",() () () () () murder () () trial () () prosecutor called () police detective () testify () () detective () () questioned () defendant () () station house () () arrest () testified () () defendant () declared () innocence () () detective () testified () () given () opportunity () take () lie detector test () () defendant refused () () defendant () attorney () () object () () detective () testimony () () defendant () convicted () sentenced () prison () () defendant () () () () represented () () new attorney () appeals () claiming () () () error () admit () detective () testimony () () appellate court () find,"['defendant', 'prosecuted', 'murder', 'prosecutor', 'called', 'police', 'detective', 'testify', 'detective', 'questioned', 'station', 'house', 'arrest', 'testified', 'defendant', 'declared', 'innocence', 'detective', 'given', 'opportunity', 'take', 'lie', 'detector', 'test', 'defendant', 'refused', 'attorney', 'object', 'testimony', 'defendant', 'convicted', 'sentenced', 'prison', 'defendant', 'represented', 'new', 'attorney', 'appeals', 'claiming', 'error', 'admit', 'detective', 'testimony', 'appellate', 'court', 'find']",46
On average what length of time passes between high tides?,() average () length () time passes () high tides (),"['average', 'length', 'time', 'passes', 'high', 'tides']",6
 The way in which the product is delivered to meet the customers' needs refers to:,() way () () () product () delivered () meet () customers () needs refers () (),"['way', 'product', 'delivered', 'meet', 'customers', 'needs', 'refers']",7
 Which of the following is one of de Marneffe's responses to the objection that drug prohibition would be paternalistic?,() () () following () () () de Marneffe () responses () () objection () drug prohibition () () paternalistic (),"['following', 'de', 'Marneffe', 'responses', 'objection', 'drug', 'prohibition', 'paternalistic']",8
"Tara can develop 2 rolls of film in about 18 minutes. At this rate, how long will it take her to develop 8 rolls of film?",Tara () develop () () () film () () () minutes () () () rate () () () () () take () () develop () rolls () film (),"['Tara', 'develop', 'film', 'minutes', 'rate', 'take', 'develop', 'rolls', 'film']",9
"Which of the following is true about the diagnosis of ""osteopenia"" or ""osteoporosis"" in North America and Western Europe
",() () () following () true () () diagnosis () () osteopenia () () () osteoporosis () () North America () Western Europe,"['following', 'true', 'diagnosis', 'osteopenia', 'osteoporosis', 'North', 'America', 'Western', 'Europe']",9
Which of the following is the best example of a categorical variable?,() () () following () () best example () () categorical variable (),"['following', 'best', 'example', 'categorical', 'variable']",5
A motor and a generator are,() motor () () generator (),"['motor', 'generator']",2
Which of the following is the most common naturally-occurring form in which silicon is found?,() () () following () () () common () () occurring form () () silicon () found (),"['following', 'common', 'occurring', 'form', 'silicon', 'found']",6
"A defendant was charged with murder. The killing took place on February 1. At the time that the crime occurred, this jurisdiction required a unanimous verdict of all 12 jury members for a conviction on a capital offense. On November 1, the state legislature enacted a new law requiring a majority vote of seven of 12 jurors to convict on a capital offense. The defendant's trial began on December 1. He was subsequently convicted of murder by an eight- to-four vote. Following the trial, the defendant's attorney filed a motion to set aside the verdict. Which of the following would provide the strongest constitutional grounds to overturn the verdict?",() () () charged () murder () () killing took place () February () () () () time () () crime occurred () () jurisdiction required () unanimous verdict () () () jury members () () conviction () () capital offense () () November () () () state legislature enacted () new law requiring () majority vote () () () () jurors () convict () () capital offense () () defendant () trial began () December () () () () () convicted () murder () () () () () () () vote () Following () trial () () defendant () attorney filed () motion () set () () verdict () () () () following () provide () strongest constitutional grounds () overturn () verdict (),"['defendant', 'charged', 'murder', 'killing', 'place', 'February', 'time', 'crime', 'occurred', 'jurisdiction', 'required', 'unanimous', 'verdict', 'jury', 'members', 'conviction', 'capital', 'offense', 'November', 'legislature', 'enacted', 'new', 'law', 'requiring', 'majority', 'vote', 'jurors', 'convict', 'capital', 'offense', 'defendant', 'trial', 'began', 'December', 'convicted', 'vote', 'Following', 'trial', 'defendant', 'attorney', 'motion', 'set', 'verdict', 'following', 'provide', 'strongest', 'grounds', 'overturn', 'verdict']",49
"A state's constitution reserves to the people of each municipality in the state the power of referendum with respect to all questions that the municipality is authorized to control by legislation. A real estate developer applied for a zoning change to permit construction of a convalescent home on land he owned in a city within the state. While the application was pending, the city charter was amended by popular vote so as to require that any changes in land use agreed to by the city council be approved by a 55% vote in a referendum. The city planning commission and the city council both approved the proposed zoning change. However, the real estate developer's subsequent application for approval for a proposed home on the grounds was rejected because the rezoning action had not been submitted to a referendum. In an action brought in state court seeking a judgment declaring the city charter amendment invalid, the court will most likely declare the amendment",() state () constitution () () () people () () () () () state () power () referendum () respect () () questions () () municipality () () () () () legislation () () real estate developer applied () () zoning change () permit construction () () convalescent home () land () owned () () city () () state () () () application () pending () () city charter () amended () popular vote () () () require () () changes () land use agreed () () () city council () approved () () () % vote () () referendum () () city planning commission () () city council () approved () proposed zoning change () () () () real estate developer () subsequent application () approval () () proposed home () () grounds () rejected () () rezoning action () () () submitted () () referendum () () () action brought () state court seeking () judgment declaring () city charter amendment invalid () () court () () () declare () amendment,"['state', 'constitution', 'reserves', 'people', 'municipality', 'state', 'power', 'referendum', 'respect', 'questions', 'municipality', 'control', 'legislation', 'real', 'developer', 'applied', 'zoning', 'change', 'permit', 'construction', 'convalescent', 'home', 'land', 'owned', 'city', 'state', 'application', 'pending', 'city', 'charter', 'amended', 'popular', 'vote', 'require', 'changes', 'land', 'use', 'agreed', 'city', 'council', 'approved', 'vote', 'referendum', 'city', 'planning', 'commission', 'city', 'approved', 'proposed', 'zoning', 'change', 'real', 'estate', 'developer', 'subsequent', 'application', 'home', 'grounds', 'rejected', 'rezoning', 'action', 'submitted', 'action', 'brought', 'state', 'court', 'seeking', 'judgment', 'declaring', 'city', 'charter', 'amendment', 'invalid', 'court', 'declare']",75
Weber defined a 'class situation' as:,Weber defined () () class situation () () (),"['Weber', 'defined', 'class', 'situation']",4
"A child is frightened by the sudden barking of a neighbor's dog. Once her mother picks her up, the child begins to calm down as which of the following biological processes occurs?",() child () frightened () () sudden barking () () neighbor () () () () () mother picks () () () () child begins () calm () () () () () following biological processes occurs (),"['child', 'frightened', 'sudden', 'barking', 'neighbor', 'mother', 'picks', 'child', 'begins', 'calm', 'following', 'biological', 'processes', 'occurs']",14
"For which of these two scenarios does the main character (who uses I/me/my) do something clearly morally wrong, according to ordinary moral standards in the US as of 2020? Scenario 1 | She wanted to decorate the apartment in a Halloween theme, so I poured spiders throughout the apartment so that we would have spiderweb decorations. Scenario 2 | I put rolled oats in a bowl in the microwave and heated it.",() () () () () scenarios () () main character () () uses () () () () () () do something () () wrong () () () ordinary moral standards () () US () () () () Scenario () () () wanted () decorate () apartment () () Halloween theme () () () poured spiders () () apartment () () () () have spiderweb decorations () Scenario () () () put rolled oats () () bowl () () microwave () heated () (),"['scenarios', 'main', 'character', 'uses', 'do', 'something', 'wrong', 'ordinary', 'moral', 'standards', 'US', 'Scenario', 'wanted', 'decorate', 'apartment', 'theme', 'poured', 'spiders', 'apartment', 'have', 'spiderweb', 'decorations', 'Scenario', 'rolled', 'oats', 'bowl', 'microwave', 'heated']",28
Cicero's conception of natural law is 'based on the idea that 'true law is right reason in agreement with Nature.' Reason is a key element because:,Cicero () conception () natural law () () based () () () () () true law () right reason () agreement () Nature () () Reason () () key element () (),"['Cicero', 'conception', 'natural', 'law', 'based', 'true', 'law', 'right', 'reason', 'agreement', 'Nature', 'Reason', 'key', 'element']",14
"If two variables, $x_t$ and $y_t$ are said to be cointegrated, which of the following statements are true?

i) $x_t$ and $y_t$ must both be stationary


ii) Only one linear combination of $x_t$ and $y_t$ will be stationary


iii) The cointegrating equation for $x_t$ and $y_t$ describes the short-run relationship

between the two series


iv) The residuals of a regression of $y_t$ on $x_t$ must be stationary",() () variables () () () () () () () () said () () cointegrated () () () () following statements () true () () () () () () () () () () () () stationary () () () () linear combination () () () () () () y_t$ () () stationary () () () cointegrating equation () () () () () () y_t$ describes () short () run relationship () () () series () () () residuals () () regression () () () () () () () () () stationary,"['variables', 'said', 'cointegrated', 'following', 'statements', 'true', 'stationary', 'linear', 'y_t$', 'stationary', 'cointegrating', 'equation', 'y_t$', 'short', 'run', 'relationship', 'series', 'residuals', 'regression', 'stationary']",20
For an SCR gate cathode characteristic is a straight line of 130. For triggered source volume of 15 V and allowable gate power dissipation of 0.5 W compute the gate source resistance?,() () SCR gate cathode characteristic () () straight line () () () () triggered source volume () () V () allowable gate power dissipation () () W compute () gate source resistance (),"['SCR', 'gate', 'cathode', 'characteristic', 'straight', 'line', 'triggered', 'source', 'volume', 'V', 'allowable', 'gate', 'power', 'W', 'compute', 'gate', 'source', 'resistance']",18
Which is a major characteristic of the bunyavirus family?,() () () major characteristic () () bunyavirus family (),"['major', 'characteristic', 'bunyavirus', 'family']",4
"For which of these two scenarios does the main character (who uses I/me/my) do something clearly morally wrong, according to ordinary moral standards in the US as of 2020? Scenario 1 | I rode my skateboard down the sidewalk. Scenario 2 | I fed my kitten wet cat food 3 times a day.",() () () () () scenarios () () main () () () uses () () () () () () () something () () wrong () according () ordinary moral standards () () US () () () () Scenario () () () rode () skateboard () () sidewalk () Scenario () () () fed () kitten wet cat food () times () day (),"['scenarios', 'main', 'uses', 'something', 'wrong', 'according', 'ordinary', 'moral', 'standards', 'US', 'Scenario', 'rode', 'skateboard', 'sidewalk', 'Scenario', 'fed', 'kitten', 'wet', 'cat', 'food', 'times', 'day']",22
Select the best translation into predicate logic. Alexis is greeted by Ben. (a: Alexis; b: Ben; Gxy: x greets y),Select () best translation () predicate logic () Alexis () greeted () Ben. () () () Alexis () () () Ben () Gxy () x greets y (),"['Select', 'best', 'translation', 'predicate', 'logic', 'Alexis', 'greeted', 'Ben.', 'Alexis', 'b', 'Ben', 'Gxy', 'x', 'greets']",14
"For which of these two scenarios does the main character (who uses I/me/my) do something clearly morally wrong, according to ordinary moral standards in the US as of 2020? Scenario 1 | I asked her for help with my computer so she installed a anti-virus software on it. Scenario 2 | I kept the fireplace lit as the chimney cleaner was in it.",() () () () () scenarios () () () character () () uses () () () () () () do something () () wrong () according () ordinary moral standards () () US () () () () Scenario () () () asked () () help () () computer () () installed () anti-virus software () () () Scenario () () () kept () fireplace lit () () chimney cleaner () () () (),"['scenarios', 'character', 'uses', 'do', 'something', 'wrong', 'according', 'ordinary', 'moral', 'standards', 'US', 'Scenario', 'asked', 'computer', 'installed', 'anti-virus', 'software', 'Scenario', 'kept', 'fireplace', 'lit', 'chimney', 'cleaner']",23
"Which of the following situations would not impair objectivity, integrity, or independence with respect to an audit client?",() () () following situations () () impair objectivity () integrity () () independence () respect () () audit client (),"['following', 'situations', 'impair', 'objectivity', 'integrity', 'independence', 'respect', 'audit', 'client']",9
The City of Windemere decided to construct several large windmills to generate electrical power. The construction was financed through a general residential property tax levy for the next ten years. Utility revenues are intended to offset all expenses associated with the windmills. The land for the windmills was donated to the city by a local farmer. The land from the farmer should be reported in which fund type?,() () () Windemere decided () construct () large () () generate electrical power () () construction () financed () () general residential property tax levy () () next () years () Utility revenues () intended () offset () expenses associated () () windmills () () land () () windmills () donated () () city () () local farmer () () land () () farmer () () reported () () fund type (),"['City', 'Windemere', 'decided', 'construct', 'several', 'large', 'windmills', 'generate', 'electrical', 'power', 'construction', 'financed', 'general', 'property', 'tax', 'next', 'years', 'Utility', 'revenues', 'intended', 'offset', 'expenses', 'associated', 'windmills', 'windmills', 'donated', 'city', 'local', 'farmer', 'land', 'farmer', 'reported', 'fund', 'type']",34
"For which of these two scenarios does the main character (who uses I/me/my) do something clearly morally wrong, according to ordinary moral standards in the US as of 2020? Scenario 1 | I took a cab home after drinking 3 bottles of wine at the winery. Scenario 2 | I hit on her at the party.",() () () () () scenarios () () main character () () uses () () () () () () do something () () wrong () according () ordinary moral standards () () US () () () () Scenario () () () took () cab () () drinking () bottles () wine () () winery () Scenario () () () hit () () () () party (),"['scenarios', 'main', 'character', 'uses', 'do', 'something', 'wrong', 'according', 'ordinary', 'moral', 'standards', 'US', 'Scenario', 'took', 'cab', 'drinking', 'bottles', 'winery', 'Scenario', 'party']",20
What does situational theory of leadership emphasise?,() () situational theory () leadership emphasise (),"['situational', 'theory', 'leadership', 'emphasise']",4
