original_question,masked_question,nouns,noun_count
"In 1985, a landowner, the undisputed owner of an apartment building, leased it to a tenant for a term of seven years. Rent was to be paid in installments due on the first day of each month. One year later, in 1986, the landowner died leaving no heirs. In her will, the landowner left her entire estate to the Girl Scouts of America. The apartment building was not specifically mentioned in the will. One month after the landowner died, the tenant, having learned of the landowner's death, decided to remain on the property, but stopped paying rent. The Girl Scouts of America organization was unaware of the landowner's gift to the organization until 2009, when attorneys for the organization conducted an inventory of testamentary gifts to the Girl Scouts of America, which revealed that they had a claim to ownership of the apartment building. The statutory period for adverse possession in this jurisdiction is 20 years. In an ejection action by the Girl Scouts of America against the tenant, the organization will prevail",() () () () landowner () () undisputed () () () () building () leased () () () () () () term () () () () Rent () () () paid () installments () () () first day () () month () () year () () () () () () landowner died leaving () heirs () () () will () () landowner left () entire estate () () Girl Scouts () America () () apartment building () () () mentioned () () will () () month () () landowner died () () tenant () () learned () () landowner () death () decided () remain () () property () () stopped paying rent () () Girl Scouts () America organization () unaware () () landowner () gift () () organization () () () () attorneys () () organization conducted () inventory () testamentary gifts () () Girl Scouts () America () () revealed () () had () claim () ownership () () apartment building () () statutory period () adverse possession () () jurisdiction () () years () () () ejection action () () Girl Scouts () America () () tenant () () organization () prevail,"['landowner', 'undisputed', 'apartment', 'building', 'leased', 'tenant', 'Rent', 'paid', 'installments', 'first', 'day', 'month', 'year', 'landowner', 'died', 'leaving', 'heirs', 'will', 'left', 'entire', 'estate', 'Girl', 'Scouts', 'America', 'apartment', 'building', 'mentioned', 'will', 'month', 'landowner', 'died', 'tenant', 'learned', 'landowner', 'death', 'decided', 'property', 'stopped', 'paying', 'rent', 'Girl', 'America', 'organization', 'landowner', 'gift', 'organization', 'attorneys', 'organization', 'conducted', 'inventory', 'testamentary', 'gifts', 'Girl', 'Scouts', 'America', 'revealed', 'had', 'claim', 'ownership', 'apartment', 'building', 'statutory', 'period', 'adverse', 'possession', 'jurisdiction', 'years', 'ejection', 'action', 'Girl', 'Scouts', 'America', 'tenant', 'prevail']",74
"Which language family contains Italian, Spanish, Portuguese, and Romanian?",() language family contains Italian () Spanish () Portuguese () () Romanian (),"['language', 'family', 'contains', 'Italian', 'Spanish', 'Portuguese', 'Romanian']",7
" According to Carruthers, which of the following groups should not be accorded direct moral standing?",According () Carruthers () () () () following groups () () () accorded direct moral standing (),"['According', 'Carruthers', 'following', 'groups', 'accorded', 'direct', 'moral', 'standing']",8
All of the following organs in the digestive system secrete digestive enzymes EXCEPT the,() () () following organs () () digestive system secrete digestive enzymes () (),"['following', 'organs', 'digestive', 'system', 'secrete', 'digestive', 'enzymes']",7
With which of the following techniques were the native navigators of the Pacific NOT familiar?,() () () () following techniques () () native navigators () () Pacific () familiar (),"['following', 'techniques', 'native', 'navigators', 'Pacific', 'familiar']",6
In what ways has the concept of environmental security been contested?,() () ways () () concept () environmental security () contested (),"['ways', 'concept', 'environmental', 'security', 'contested']",5
"According to Socrates, it is important that we discover what makes a particular action (e.g., a merciful or just act) the kind of action that it is, because without such knowledge:",According () Socrates () () () important () () discover () makes () () action () () () () merciful () () act () () kind () action () () () () () () such knowledge (),"['According', 'Socrates', 'important', 'discover', 'makes', 'action', 'merciful', 'act', 'kind', 'action', 'such', 'knowledge']",12
"For which of these two scenarios does the main character (who uses I/me/my) do something clearly morally wrong, according to ordinary moral standards in the US as of 2020? Scenario 1 | I ironed the clothes while my children were playing outside. Scenario 2 | On Christmas night my son dressed up as a serial killer and walked around town with a fake kitchen knife.",() () () () () scenarios () () main character () () uses () () () () () () do something () () () () according () () moral standards () () US () () () () Scenario () () () ironed () clothes () () children () playing () () Scenario () () () Christmas night () son dressed () () () serial killer () walked () town () () fake kitchen knife (),"['scenarios', 'main', 'character', 'uses', 'do', 'something', 'according', 'moral', 'standards', 'US', 'Scenario', 'ironed', 'clothes', 'children', 'playing', 'Scenario', 'Christmas', 'night', 'son', 'dressed', 'serial', 'killer', 'walked', 'town', 'fake', 'kitchen', 'knife']",27
On a bank's balance sheet which of the following is considered a liability?,() () bank () balance sheet () () () following () considered () liability (),"['bank', 'balance', 'sheet', 'following', 'considered', 'liability']",6
Who was the first First Lady to run for political office?,() () () first First Lady () run () political office (),"['first', 'First', 'Lady', 'run', 'political', 'office']",6
"For which of these two scenarios does the main character (who uses I/me/my) do something clearly morally wrong, according to ordinary moral standards in the US as of 2020? Scenario 1 | I picked up the money the man dropped and put it in my pocket. Scenario 2 | After work, I decided to cook dinner for my baby to eat.",() () () () () scenarios () () main character () () uses () () () () () () () something () () wrong () according () ordinary moral standards () () US () () () () Scenario () () () picked () () money () man dropped () put () () () pocket () Scenario () () () work () () decided () cook dinner () () baby () eat (),"['scenarios', 'main', 'character', 'uses', 'something', 'wrong', 'according', 'ordinary', 'moral', 'standards', 'US', 'picked', 'money', 'man', 'dropped', 'put', 'pocket', 'Scenario', 'work', 'decided', 'cook', 'dinner', 'baby', 'eat']",24
With which of the following relatives is an individual most likely to share a common HLA haplotype?,() () () () following relatives () () individual () likely () share () common HLA haplotype (),"['following', 'relatives', 'individual', 'likely', 'share', 'common', 'HLA', 'haplotype']",8
Which of the following is an example of a chemical change?,() () () following () () example () () chemical change (),"['following', 'example', 'chemical', 'change']",4
"Buyer purchases an item from a merchant that turns out to be unfit, defective and unsafe for its ordinary purposes. Assuming no other warranties, which of the following can be invoked by the buyer?",Buyer purchases () item () () merchant () turns () () () unfit () defective () unsafe () () ordinary purposes () Assuming () other warranties () () () () following () () invoked () () buyer (),"['Buyer', 'purchases', 'item', 'merchant', 'turns', 'unfit', 'defective', 'unsafe', 'ordinary', 'purposes', 'Assuming', 'warranties', 'following', 'invoked', 'buyer']",15
Intermediaries assist end-users by bringing a product produced a long way away to a more convenient location for purchase and consumption. This is referred to as:,Intermediaries assist end () users () bringing () () produced () long way () () () () convenient location () purchase () consumption () () () referred () () (),"['Intermediaries', 'assist', 'end', 'users', 'bringing', 'produced', 'long', 'way', 'convenient', 'location', 'purchase', 'consumption', 'referred']",13
Which step explains how to find the value of a in 6a = 72?,() step explains () () find () value () () () () () () (),"['step', 'explains', 'find', 'value']",4
Which of the following countries is actively trying to preserve the purity of their native language from contamination by English or other languages?,() () () following countries () () trying () preserve () purity () () native language () () () English () other languages (),"['following', 'countries', 'trying', 'preserve', 'purity', 'native', 'language', 'English', 'other', 'languages']",10
